{
  "schemaVersion": "binrat.recorded-evidence/1",
  "provenance": "RECORDED_RPC_RETROSPECTIVE",
  "job": {
    "schemaVersion": "binrat.recorded-job/1",
    "mode": "OFFLINE_REPLAY",
    "jobId": "recorded-pons-funding-a",
    "leadRat": "SNIFFER",
    "objective": "REPLAY_RECORDED_FUNDING_AND_PONS_LAUNCH",
    "subject": {
      "chainId": 4663,
      "entityType": "WALLET",
      "entityId": "0x9bc462bce2acd6fbe2ef5470d55b439453451083"
    },
    "authority": {
      "research": true,
      "network": false,
      "provider": false,
      "delivery": false,
      "capital": false
    },
    "budget": {
      "maxToolCalls": 4,
      "maxHandoffs": 0,
      "maxModelCalls": 0,
      "maxCostMicrousd": 0
    },
    "window": {
      "fromBlock": "77795399",
      "toBlock": "81253814"
    }
  },
  "recording": {
    "endpoint": "https://rpc.mainnet.chain.robinhood.com",
    "responses": [
      {
        "label": "chain",
        "request": {
          "jsonrpc": "2.0",
          "id": 1,
          "method": "eth_chainId",
          "params": []
        },
        "response": {
          "jsonrpc": "2.0",
          "id": 1,
          "result": "0x1237"
        },
        "receivedAt": "2026-10-06T01:40:56.293207+00:00"
      },
      {
        "label": "factoryCode",
        "request": {
          "jsonrpc": "2.0",
          "id": 2,
          "method": "eth_getCode",
          "params": [
            "0x7ed598bcef8bd9edd8c97a195c6d13f40801ec7e",
            "latest"
          ]
        },
        "response": {
          "jsonrpc": "2.0",
          "id": 2,
          "result": "0x6102a0604052600436101561001b575b3615610019575f80fd5b005b5f5f3560e01c806302d4753d14612fc5578063092c08bd14612e7e5780630e5b0aae14612c7f57806312261ee714612c3b578063189eb0f514612b7c5780631cad862d14612ac05780632260aead14612a5b578063236a4afb14612a395780632931861b146129c85780632d1250b8146129ab5780632f53ef2f146120a85780633108213414612046578063366f0f3e14611fc75780633a9391e814611f435780633cf28b5a14611cbf5780633d3d2d5814611bcb578063470ef5fc14611b26578063496aa10014611ae157806350e25ac214611ac35780635313be2c14611a7557806358373f0414611a475780635a83b00a14611a425780636651812c146119fd5780636783774b146119df5780636e47a1881461199e578063715018a61461197e578063767b7c16146118fc578063791b98bc146118b757806379ba5097146118375780637aed273e14611620578063858f5964146115f75780638763e3dc146114b75780638da5cb5b146114905780639831705e146114515780639b924452146114285780639beacf4a146113c8578063a72101af1461135f578063ae72d87114611341578063b18f1db11461111d578063b20e51af1461109b578063c4b7de9714611056578063cc6d7a391461102d578063cf3cf5731461100f578063d1ec471a14610f9a578063d6a0eef514610eb4578063d7b96d4e14610e6f578063da3eda6514610e30578063dbcb9c7614610c04578063dc4c90d314610bbf578063e102c9aa14610a69578063e30c397814610a40578063e73e334a14610838578063f1f5c993146107f3578063f2fde38b14610786578063f325a5fb14610768578063f35abbcf146106e5578063f56f05b214610681578063f718b78c14610562578063fbec2d8b146104bc5763ff6d8d05146102ba575061000f565b346104b95760203660031901126104b9576102d3612fe2565b6102db61349c565b6001600160a01b0381168252600e60205260408220600a81015460ff16156104aa5760ff600682015460481c1660048110156104965761048757600181015460405163c68360a560e01b81526001600160a01b039091169190602081600481865afa90811561043b578591610458575b501561044657604051634f1f58fd60e01b815292602084600481865afa93841561043b578594610407575b5060405163cbcb317160e01b8152602081600481875afa9081156103fc5786916103c4575b506103ab906103b09584846136db565b6139e7565b60015f516020615e1c5f395f51905f525580f35b90506020813d6020116103f4575b816103df6020938361310f565b810103126103f057516103b061039b565b5f80fd5b3d91506103d2565b6040513d88823e3d90fd5b9093506020813d602011610433575b816104236020938361310f565b810103126103f05751925f610376565b3d9150610416565b6040513d87823e3d90fd5b6001620b9b5560e31b03198452600484fd5b61047a915060203d602011610480575b610472818361310f565b81019061320e565b5f61034b565b503d610468565b63251976f560e21b8352600483fd5b634e487b7160e01b84526021600452602484fd5b630cbdb7b360e41b8352600483fd5b80fd5b50346104b95760203660031901126104b9576004356001600160a01b0381169081900361055e576104eb61331d565b6002546001600160a01b03811661054f578115610540576001600160a01b03191681176002556040519081527fac04674474e93058fae25e6df5dd94f57cdcacfe560a182a2eefc8c6006fbf6f90602090a180f35b63d92e233d60e01b8352600483fd5b63a741a04560e01b8352600483fd5b5080fd5b50346104b95760403660031901126104b95760043561057f612ff8565b906010548110156106725761059661059c91613130565b50613183565b906001600160a01b03168061064f575060408101516060820151915b604051631134d37b60e31b81529060a0826004817f000000000000000000000000e5e702641ea86f4ae6cc3cdaed2b886f976be0446001600160a01b03165afa91821561043b5790610616949392916020969261061e575b5061561e565b604051908152f35b61064191925060a03d60a011610648575b610639818361310f565b8101906132b4565b905f610610565b503d61062f565b808352600c6020526040832054908352600c6020526001604084200154916105b8565b6368b42c5960e01b8352600483fd5b50346104b95760203660031901126104b95760043580151580910361055e5760207f4f1ea5016c51c2f82324e00e9b8a4a95ee5aeaa10c653dabaec5f1bc9047ba0b916106cc61331d565b60ff196009541660ff821617600955604051908152a180f35b5060603660031901126104b9576004356001600160401b03811161055e57610140600319823603011261055e576107349061071e61300e565b61072661349c565b339160243590600401613bd1565b60015f516020615e1c5f395f51905f5255604080516001600160a01b039384168152929091166020830152819081015b0390f35b50346104b957806003193601126104b9576020600554604051908152f35b50346104b95760203660031901126104b9576107a0612fe2565b6107a861331d565b600180546001600160a01b0319166001600160a01b0392831690811790915582549091167f38d16b8cac22d99fc7c124b9cd0de2d3fa1faef420bfe791d8c362d765e227008380a380f35b50346104b957806003193601126104b9576040517f00000000000000000000000042df2a798f82289e177311362e8f5ccc45c1219c6001600160a01b03168152602090f35b50346104b9576101003660031901126104b95760043560e036602319011261055e5761086261331d565b601054811015610a31576044356103e88111610a2257602435670de0b6b3a76400008110610a135760016001607f1b038111610a04576064359182156109f5576084359081156109e65760c435928360020b928385141593846109e257888113908115916109d3575b506109c45760a4359562ffffff8716938488036109c057846109b1576108f2818584613361565b6108fb89613130565b94909461099d578455600184015560028301556003820155600401805462ffffff1916919091178155925061099957815460189190911b65ffffff0000001665ffffff0000001990911617815560e43580151590818103610995575060ff60301b82549160301b169060ff60301b19161790557f2f8ba78ae68cfd0c82c7756c540eaf4eead3341aef9ccebcb91d546bff10d62b8280a280f35b8480fd5b8380fd5b634e487b7160e01b8b5260048b905260248bfd5b634292c38960e11b8a5260048afd5b8980fd5b63013840ad60e51b8852600488fd5b945050617fff5f94135f6108cb565b8880fd5b6315dc5eeb60e11b8652600486fd5b63056f5a9f60e31b8552600485fd5b63acb9fa2b60e01b8452600484fd5b63c0b4e37360e01b8452600484fd5b6313888a8960e21b8352600483fd5b6368b42c5960e01b8252600482fd5b50346104b957806003193601126104b9576001546040516001600160a01b039091168152602090f35b50346104b95760403660031901126104b957610a83612fe2565b610a8b612ff8565b90610a9461331d565b6001600160a01b0316808352600e60205260408320600a8101549192909160ff1615610bb0576001600160a01b0316918215610ba1576203f4804201804211610b8d576207e900420192838211610b79577f7f119e44c84a715429bee60d30ad2e14afdef6c60bb1a7eaa01290ecf6d1b2e5916040918251610b15816130a2565b8781526020808201848152858301898152888c52600f8352868c20935184546001600160a01b0319166001600160a01b039182161785559151600185015551600293909301929092556003929092015484519384529183019690965290941693a480f35b634e487b7160e01b86526011600452602486fd5b634e487b7160e01b85526011600452602485fd5b63d92e233d60e01b8452600484fd5b630cbdb7b360e41b8452600484fd5b50346104b957806003193601126104b9576040517f0000000000000000000000008366a39cc670b4001a1121b8f6a443a643e409516001600160a01b03168152602090f35b50346104b95760403660031901126104b957610c1e612fe2565b610c26612ff8565b90610c2f61331d565b610c3761349c565b6001600160a01b0316808352600e60205260408320600a81015460ff1615610bb057600681019060ff825460481c166004811015610e1c57600103610e0d576001600160a01b038416938415610dfe576009820192835462093a808101809111610dea57804210610dd85750600783018054600885018054600490960154928a905589905594889055815460ff60481b19166903000000000000000000179091556001600160a01b031683610d47575b5091817f7017304fdd491394686dce984eac721f0be1a22228346210f16694772bde44ca9381604094610d36575b505082519182526020820152a360015f516020615e1c5f395f51905f525580f35b610d4091876155a6565b5f81610d15565b80610da257508580808086895af1610d5d613262565b5015610d9357916040917f7017304fdd491394686dce984eac721f0be1a22228346210f16694772bde44ca935b91935091610ce7565b634033e4e360e01b8652600486fd5b9181610dd3857f7017304fdd491394686dce984eac721f0be1a22228346210f16694772bde44ca96946040966155a6565b610d8a565b63bdcd75af60e01b8852600452602487fd5b634e487b7160e01b88526011600452602488fd5b63d92e233d60e01b8652600486fd5b63251976f560e21b8552600485fd5b634e487b7160e01b86526021600452602486fd5b50346104b95760203660031901126104b95760209060ff906040906001600160a01b03610e5b612fe2565b168152600a84522054166040519015158152f35b50346104b957806003193601126104b9576040517f000000000000000000000000267444d099b10fb5ed7c3cc7b7c767adca5749526001600160a01b03168152602090f35b5060a03660031901126104b957600435906001600160401b0382116104b95761014060031983360301126104b957610eea61300e565b606435906001600160a01b0382168203610f96576084356001600160401b03811161099957610f1d903690600401613072565b949093610f2861349c565b6004546001600160a01b03163303610f87575091610f5091610f599360243590600401613bd1565b93909284615483565b60015f516020615e1c5f395f51905f5255604080516001600160a01b03928316815292909116602083015290f35b63754f554b60e11b8152600490fd5b8280fd5b50346104b95760203660031901126104b957600435610fb761331d565b80158015611005575b610ff6576020817f2b1bf8cf5a401a6dd314ae29520988783e31f0e50ec734aa9ef26b8b7ff24a1f92600755604051908152a180f35b63d9521a8560e01b8252600482fd5b50603c8111610fc0565b50346104b957806003193601126104b9576020600854604051908152f35b50346104b957806003193601126104b9576002546040516001600160a01b039091168152602090f35b50346104b95780600319360112